{
  "$schema": "https://json-schema.org/draft/2020-12/schema",
  "type": "object",
  "required": [
    "attack_id",
    "category",
    "action",
    "expected",
    "required_for_release"
  ],
  "properties": {
    "attack_id": {
      "type": "string"
    },
    "category": {
      "type": "string"
    },
    "action": {
      "type": "string"
    },
    "expected": {
      "type": "string"
    },
    "required_for_release": {
      "type": "boolean"
    }
  }
}